{
  "invite": "9f8d2c1a-opaque-invite-token",
  "install_id": "3f2504e0-4f89-41d3-9a0c-0305e82c3301",
  "device_public_key": "A6EHv/POEL4dcN0Y50vAmWfk1jCbpQ1fHdyGZBJVMbg=",
  "age_recipient": "age1cpx4grz9j4fkn36cfurggwcg4l0da5fyqadl8fwagtcwy55gt44qlclfa5",
  "hostname": "dev-laptop",
  "platform": "darwin/arm64"
}
